{
  "version": 1,
  "source": "01-scope-and-identity.md",
  "manualClauses": ["C01-01", "C01-03", "C01-04"],
  "policies": [
    {
      "id": "site-auto-binding",
      "clauses": ["C01-02", "C01-05", "C01-06", "C01-07"],
      "facts": ["actualAddressResolved", "insidePilotCounty", "rangeVerified", "uniqueRangeMatch", "noDuplicateOrDispute"],
      "allowWhen": {
        "actualAddressResolved": true,
        "insidePilotCounty": true,
        "rangeVerified": true,
        "uniqueRangeMatch": true,
        "noDuplicateOrDispute": true
      },
      "cases": [
        {
          "name": "verified unique match",
          "input": {"actualAddressResolved": true, "insidePilotCounty": true, "rangeVerified": true, "uniqueRangeMatch": true, "noDuplicateOrDispute": true},
          "allowed": true
        },
        {
          "name": "address unresolved",
          "input": {"actualAddressResolved": false, "insidePilotCounty": true, "rangeVerified": true, "uniqueRangeMatch": true, "noDuplicateOrDispute": true},
          "allowed": false
        },
        {
          "name": "range not verified",
          "input": {"actualAddressResolved": true, "insidePilotCounty": true, "rangeVerified": false, "uniqueRangeMatch": true, "noDuplicateOrDispute": true},
          "allowed": false
        },
        {
          "name": "multiple candidates",
          "input": {"actualAddressResolved": true, "insidePilotCounty": true, "rangeVerified": true, "uniqueRangeMatch": false, "noDuplicateOrDispute": true},
          "allowed": false
        },
        {
          "name": "disputed site",
          "input": {"actualAddressResolved": true, "insidePilotCounty": true, "rangeVerified": true, "uniqueRangeMatch": true, "noDuplicateOrDispute": false},
          "allowed": false
        }
      ]
    }
  ]
}
